homograph	wordid	sentence	start	end	orig_idx
confines	confines_nou	This is the boy's first step beyond the confines of home and school.	40	48	2312
confines	confines_nou	He founded the city of Rhinocolura on the confines of Egypt and Syria, and was succeeded by Mendes, an Egyptian.	42	50	11689
confines	confines_nou	There are five public schools and two private schools located in with in the confines of the Mattapan neighborhood.	77	85	2291
confines	confines_nou	The items of the Crown Collection are available exclusively at retail outlets within the confines of Madison Square Garden.	89	97	2258
confines	confines_nou	An inlay is a restoration which lies within the confines of the cusps.	48	56	2241
confines	confines_nou	The footsoldiers immediately retreated inside the confines of the barracks while the men on horseback stayed outside.	50	58	2259
confines	confines_nou	Distributed work entails the conduct of organizational tasks in places that extend beyond the confines of traditional offices or workspaces.	94	102	2251
confines	confines_nou	This can turn quite vicious in the limited confines of captivity.	43	51	2301
confines	confines_nou	The constraints of folding puzzles is to fold designated shapes within the given confines of the paper.	81	89	2295
confines	confines_nou	In addition, the gun proved to be too powerful for the limited confines of the Potomac.	63	71	2290
confines	confines_nou	The principle is that birth within the confines of the State gives only the status of a subject.	39	47	2280
confines	confines_nou	Through this, an adolescent acquires 'appropriate attitudes and values' needed to further succeed within the confines of education.	109	117	2293
confines	confines_nou	Matthews printed a wide range of work beyond the confines of drama.	49	57	2270
confines	confines_nou	Bagnoli is a western seaside quarter of Naples, Italy, well beyond the confines of the original city.	71	79	2267
confines	confines_nou	Holliday Lake State Park is a state park located within the confines of Appomattox-Buckingham State Forest in Virginia.	60	68	2284
confines	confines_nou	It should be aware of the impact its rulings may have outside the confines of the Community.	66	74	2278
confines	confines_nou	As a general rule the Defence Fire and Rescue Service only operates within the confines of the site it protects.	79	87	2298
confines	confines_nou	The pact formed the first extension of Papal territory beyond the confines of the Duchy of Rome.	66	74	2238
confines	confines_nou	In the main confines of the box, a plastic tray was recessed into which the cartridge fit snugly.	12	20	2287
confines	confines_nou	This ward stretches beyond the confines of Beckermet parish with a total population of 3,024.	31	39	2256
confines	confines_nou	On the confines of the settlement, there is a pond originating from ballast-digging.	7	15	2263
confines	confines_nou	He is known for using surreal humor and camp (style) within the confines of low-budget film.	64	72	2296
confines	confines_nou	Benedictine monks, for instance, have often staffed parishes and been allowed to leave monastery confines.	97	105	2243
confines	confines_nou	While Shakespeare establishes himself, Judith is trapped by the confines of the expectations of women.	64	72	2268
confines	confines_nou	Also, time itself passes much differently within the confines of the Marvel Universe than it does in the real world.	53	61	11696
confines	confines_nou	The balds are inhabited by a herd of introduced ponies allowed to run wild within the confines of the park.	86	94	2300
confines	confines_nou	From the 1960s, Shahan Natalie preferred to be silent and remained within the confines of his home.	78	86	2308
confines	confines_nou	Five men wake up inside the stolid confines of a factory to find themselves locked in this claustrophobic nowhere land.	35	43	2283
confines	confines_nou	The 4th Ring Road runs within the confines of the city of Beijing, more like a rectangle than a circle.	34	42	2318
confines	confines_nou	Part of the river exists within the confines of the Alafia River State Park.	36	44	2320
confines	confines_nou	The burial places found on the confines of the town render this pretension probable.	31	39	2297
confines	confines_nou	Its confines are within the 10th Police Precinct.	4	12	2272
confines	confines_nou	These offer a unique semi-secluded lakeside camping experience within the confines of the supervised camp.	74	82	2245
confines	confines_nou	Their careers reveal the public acceptance of female management and authority within the confines of the tavern.	89	97	11687
confines	confines_nou	Within the confines of Stonebridge, there is a hospital, five elementary schools and two middle schools.	11	19	2317
confines	confines_nou	This, her best-known work, is the story of a woman trapped in the confines of an oppressive society.	66	74	2257
confines	confines_nou	Gradually, the Germans were pushed back to the confines of the narrow perimeter around the traffic bridge.	47	55	2314
confines	confines_nou	Variants of the subject outside such formal confines include natural and quasi-natural experiments.	44	52	2279
confines	confines_nou	"He ""studied journalism at Vilnius University in the late 1950s before becoming disillusioned by the confines of the Soviet-controlled press."	100	108	2313
confines	confines_nou	The entire area of Norton lies within the confines of Wise County, but is not a part of the county.	42	50	2265
confines	confines_nou	Severe thyroid atrophy presents often with denser fibrotic bands of collagen that remains within the confines of the thyroid capsule.	101	109	2319
confines	confines_nou	Aerial photographs as early at the middle 1950s showed circular crop marks within the confines of the hill fort.	86	94	11695
confines	confines_nou	In the late 1970s and early 1980s, programmers worked within the confines of relatively expensive and limited resources.	65	73	2247
confines	confines_nou	During the Pan Am's first three seasons NMSU compiled a gaudy 44-1 record within its friendly confines.	94	102	2264
confines	confines_nou	Gix flees and hides within the confines of Koilos.	31	39	2260
confines	confines_nou	Within its confines is the Holy Cross Cemetery, Brooklyn, which is located at 3620 Tilden Avenue.	11	19	2233
confines	confines_nou	Due to the terms of its license, the signal was limited to the confines of the Florida State campus.	63	71	2294
confines	confines_nou	The entire highway is within the confines of the Pisgah National Forest.	33	41	2261
confines	confines_nou	"As the car passes through his neighborhood, Leonard Mead in the locked confines of the backseat says, ""That's my house""."	71	79	2305
confines	confines_nou	She argues for education beyond the confines of traditional knowledge.	36	44	2273
confines	confines_nou	The fight was now within the confines of the greater fortress complex.	29	37	2266
confines	confines_nou	The Tiples have sung not only inside the confines of Santo Domingo Church, but also in many varied locations.	41	49	2235
confines	confines_nou	Local citizens continued to be buried on the site within the confines of the church until 1865.	61	69	2292
confines	confines_nou	The confines of the Habsburg Castle had become too small for the family members that lived there.	4	12	2274
confines	confines_nou	"Offbeat in New Orleans described Zaorski's first songwriting effort as fitting ""snugly in the confines of Depression-era pop music""."	94	102	2309
confines	confines_nou	Mr Tommasini sought to judge her narrowly, within the facile intellectual confines of mere technical pedantry.	74	82	2246
confines	confines_nou	Michael remained in federal custody for another year within the confines of the halfway house.	64	72	2275
confines	confines_nou	But Chekhov dies, and Vanya finds the resoluteness to stride out of the confines of his creator's world.	72	80	2254
confines	confines_nou	Enemies may move outside the confines of the screen, but players may not.	29	37	2276
confines	confines_nou	The fall of Teotihuacan is associated with the emergence of city-states within the confines of the central area of Mexico.	83	91	2315
confines	confines_nou	Many of these ships are far better suited to the open ocean than to the narrow confines of the canal.	79	87	2282
confines	confines_nou	In 1707 construction was begun on a wall to enclose the monastery grounds, uniting the various buildings within its confines.	116	124	2232
confines	confines_vrb	The Strangers use a base 13 number system and it confines the krul to a certain order.	49	57	2285
confines	confines_vrb	Christie confines the events of 1945 to 1965 to just twenty-three pages.	9	17	2240
confines	confines_vrb	Audrey confines in Cleo what Trilby had told her making Cleo feel extremely embarrassed.	7	15	2299
confines	confines_vrb	Jarvis confines Jamie and the Doctor to the sickbay.	7	15	11690
confines	confines_vrb	She wears a red flat hat over a small cap or caul that confines her hair.	55	63	11692
confines	confines_vrb	His paraplegia confines Bruce to a wheelchair.	15	23	2286
confines	confines_vrb	Mrs. Bridgetower is also outraged, although she confines this to her personal circle.	48	56	2262
confines	confines_vrb	This suggests the Van Allen belt confines antiparticles produced by the interaction of the Earth's upper atmosphere with cosmic rays.	33	41	11694
confines	confines_vrb	Exercising caution, Napier arms the loyal hundred and confines the remainder below.	54	62	2307
confines	confines_vrb	It assists in the circulation of blood and protects and confines the visceral organs.	56	64	11691
confines	confines_vrb	He confines Marian when she tries to summon help from France.	3	11	2289
confines	confines_vrb	If this is what he sees, the kohen exits the house and confines it for seven days.	55	63	2237
confines	confines_vrb	Libertarianism, in contrast, is a political philosophy which confines its attention to matters of public policy.	61	69	2248
confines	confines_vrb	The minister confines these problems to Lara, a member of the security forces.	13	21	11693
confines	confines_vrb	She refuses and confines Blue Team in a Forerunner prison, to prevent them from interfering with her plan.	16	24	2242
confines	confines_vrb	Tommen confines Cersei to the Red Keep after her release, in order to protect her from the Faith Militant.	7	15	2302
confines	confines_vrb	The medium is typically a fiber of silica glass that confines the incident light beam to the inside.	53	61	2306
confines	confines_vrb	Secretive and cautious, the blue duiker confines itself to the forest fringes.	40	48	11688
